{
  "schemaVersion": 1,
  "defaultLocale": "en",
  "locales": [
    {
      "id": "en",
      "direction": "ltr"
    }
  ],
  "profile": {
    "id": "ahmed-esmail",
    "fullName": "Ahmed AbdElHady Mohamed Esmail",
    "displayName": "Ahmed Esmail",
    "role": {
      "en": "AI & Machine Learning Engineer"
    },
    "location": {
      "en": "Cairo, Egypt"
    }
  },
  "hero": {
    "heading": {
      "en": "Your ideas Built with AI"
    },
    "subtitle": {
      "en": "AI & Machine Learning Engineer"
    },
    "question": {
      "en": "Who is he?"
    },
    "cta": {
      "en": "Find out"
    },
    "hint": {
      "en": "Scroll to explore"
    }
  },
  "about": {
    "heading": {
      "en": "The engineer behind the systems"
    },
    "bio": {
      "en": "Results-driven AI & Machine Learning Engineer with a solid foundation in Computer Vision, NLP, and Deep Learning architectures. Proven ability to architect end-to-end AI pipelines, from training custom models to deploying production-ready RESTful APIs using FastAPI and Docker. Adept at bridging traditional Machine Learning with modern Generative AI, leveraging tools like LangChain and LangGraph to build stateful, multi-agent workflows. Passionate about solving complex business challenges through scalable, data-driven solutions and continuous technical growth."
    },
    "capabilityStatements": [
      {
        "en": "Computer vision and deep learning models."
      },
      {
        "en": "Local retrieval-augmented generation and stateful AI agents."
      },
      {
        "en": "Validated APIs, model optimization and containerized deployment."
      }
    ]
  },
  "portrait": {
    "id": "portrait",
    "source": "Picsart_26-07-31_23-36-42-453.jpg.jpeg",
    "width": 3072,
    "height": 4096,
    "sha256": "b7d08c04b6759e21e6f58df44069329584ed4c826891066f7473fe800add15e4",
    "alt": {
      "en": "Portrait of Ahmed Esmail"
    },
    "cutout": "assets/portrait-source-cutout.webp",
    "heroCrop": {
      "x": 0.1875,
      "y": 0.01171875,
      "width": 0.625,
      "height": 0.46875
    },
    "aboutCrop": {
      "x": 0.1875,
      "y": 0.01171875,
      "width": 0.625,
      "height": 0.890625
    },
    "faceBox": {
      "x": 0.3984375,
      "y": 0.0478515625,
      "width": 0.20572916666666666,
      "height": 0.1962890625
    }
  },
  "socials": [
    {
      "id": "linkedin",
      "kind": "linkedin",
      "label": {
        "en": "LinkedIn"
      },
      "url": "https://linkedin.com/in/ahmed-abdelhady-esmail"
    },
    {
      "id": "github",
      "kind": "github",
      "label": {
        "en": "GitHub"
      },
      "url": "https://github.com/ABo-EsMail"
    },
    {
      "id": "facebook",
      "kind": "other",
      "label": {
        "en": "Facebook"
      },
      "url": "https://www.facebook.com/AhmedAbdElHady222/"
    },
    {
      "id": "email",
      "kind": "email",
      "label": {
        "en": "Email"
      },
      "url": "mailto:ahmedaboesmail16@gmail.com"
    }
  ]
}
